{"version": "canon_geo_composition_request.v0", "profile": {"version": "canon_geo_composition_profile.v0", "selection_level": "parcel"}, "universe": {"parcels": ["04348-000-0141#61509", "04348-116-0010#597363"], "buildings": []}, "hard_constraints": [{"id": "hyp.news_size_band.ksat_158_acre", "constraint": {"kind": "integer_sum_band", "level": "parcel", "measure": {"semantic_id": "parcel_area_acres_x100", "unit": "acre/100", "value_origin": "exact_derived"}, "values": [{"id": "04348-000-0141#61509", "value": 2243}, {"id": "04348-116-0010#597363", "value": 9452}], "min": 14220, "max": 17380}}], "soft_preferences": [], "max_assignments": 65536, "max_materialized_models": 65536}