{"version": "canon_geo_composition_request.v0", "profile": {"version": "canon_geo_composition_profile.v0", "selection_level": "parcel"}, "universe": {"parcels": ["04347-000-1042#49288", "04347-000-1051#61505", "04348-000-0141#61509", "04349-000-0072#61512", "04399-000-0010#61748", "04348-000-0100#61788", "04348-000-0021#63020", "04348-000-0082#63154", "04348-102-0031#63156", "04369-000-0015#497643", "04348-116-0010#597363", "04349-101-0030#621101", "04347-000-1080#673581", "04347-237-9010#683099", "04349-130-0030#692922"], "buildings": []}, "hard_constraints": [{"id": "hyp.news_size_band.ksat_158_acre", "constraint": {"kind": "integer_sum_band", "level": "parcel", "measure": {"semantic_id": "parcel_area_acres_x100", "unit": "acre/100", "value_origin": "exact_derived"}, "values": [{"id": "04347-000-1042#49288", "value": 4688}, {"id": "04347-000-1051#61505", "value": 3103}, {"id": "04348-000-0141#61509", "value": 2243}, {"id": "04349-000-0072#61512", "value": 2243}, {"id": "04399-000-0010#61748", "value": 19884}, {"id": "04348-000-0100#61788", "value": 2535}, {"id": "04348-000-0021#63020", "value": 11454}, {"id": "04348-000-0082#63154", "value": 2285}, {"id": "04348-102-0031#63156", "value": 5215}, {"id": "04369-000-0015#497643", "value": 4025}, {"id": "04348-116-0010#597363", "value": 9452}, {"id": "04349-101-0030#621101", "value": 2205}, {"id": "04347-000-1080#673581", "value": 2573}, {"id": "04347-237-9010#683099", "value": 2316}, {"id": "04349-130-0030#692922", "value": 4470}], "min": 7900, "max": 41080}}], "soft_preferences": [{"id": "pref.owner.04348-000-0141#61509", "member": {"level": "parcel", "id": "04348-000-0141#61509"}, "cost_if_absent": 3}, {"id": "pref.owner.04348-116-0010#597363", "member": {"level": "parcel", "id": "04348-116-0010#597363"}, "cost_if_absent": 3}], "max_assignments": 65536, "max_materialized_models": 65536}